华盛,菠萝拉塔基亚切片 Erinmore Latakia Flake 50g,菠萝拉塔基亚切片,Erinmore Latakia Flake,75.52,113.28,11.12,60,9.60,1132.8,9.6,33.96,38.06,50,库存仅剩 4,烟斗（斗草）
花店,三只狗/Three Dogs Cigar Blend 30g装,三只狗,/Three Dogs Cigar Blend,46.8,70.2,6.89,36,5.76,1170.0,5.76,35.0,39.1,30,?,手卷（手卷丝）
花店,三只狗/Three Dogs Latakia Blend 30g装,三只狗,/Three Dogs Latakia Blend,46.8,70.2,6.89,36,5.76,1170.0,5.76,35.0,39.1,30,?,手卷（手卷丝）
花店,三只狗/Three Dogs Cavendish Blend 30g装,三只狗,/Three Dogs Cavendish Blend,46.8,70.2,6.89,36,5.76,1170.0,5.76,35.0,39.1,30,?,手卷（手卷丝）
花店,三只狗/Three Dogs Madagascar Vanilla 30g装,三只狗,/Three Dogs Madagascar Vanilla,46.8,70.2,6.89,36,5.76,1170.0,5.76,35.0,39.1,30,?,手卷（手卷丝）
花店,三只狗/Three Dogs Kretek Blend 30g装,三只狗,/Three Dogs Kretek Blend,46.8,70.2,6.89,36,5.76,1170.0,5.76,35.0,39.1,30,?,手卷（手卷丝）
花店,三只狗/Three Dogs Perique Blend 30g装,三只狗,/Three Dogs Perique Blend,46.8,70.2,6.89,36,5.76,1170.0,5.76,35.0,39.1,30,?,手卷（手卷丝）
花店,三只狗/Three Dogs Turkish Blend 30g装,三只狗,/Three Dogs Turkish Blend,46.8,70.2,6.89,36,5.76,1170.0,5.76,35.0,39.1,30,?,手卷（手卷丝）
华盛,查卡姆2号 Charcom No 2 50g,查卡姆,2号 Charcom No 2,78.12,117.18,11.51,60,9.60,1171.8,9.6,35.05,39.15,50,无货,烟斗（斗草）
华盛,罗伯特麦康奈尔有限储备 Robert McConnell Limited Reserve 100g,罗伯特麦康奈尔有限储备,Robert McConnell Limited Reserve,156.24,234.36,23.01,120,19.20,1171.8,19.2,35.05,39.15,100,无货,烟斗（斗草）
华盛,马坝海军切片 Mac Baren Navy Flake 50g,馬霸,马坝海军切片 Navy Flake,79.58,119.37,11.72,60,9.60,1193.7,9.6,35.66,39.76,50,有货,烟斗（斗草）
华盛,马坝香草切片 Mac Baren Vanilla Flake Cut 50g,馬霸,马坝香草切片 Vanilla Flake Cut,79.58,119.37,11.72,60,9.60,1193.7,9.6,35.66,39.76,50,有货,烟斗（斗草）
华盛,萨维内利莱昂纳多 Savinelli Leonardo 100g,萨维内利莱昂纳多,Savinelli Leonardo,160.37,240.56,23.62,120,19.20,1202.8,19.2,35.92,40.02,100,无货,烟斗（斗草）
华盛,丹地中海 Dan Tobacco Mediterraneo 100g,丹,地中海 Dan Tobacco Mediterraneo,160.81,241.22,23.68,120,19.20,1206.1,19.2,36.01,40.11,100,无货,烟斗（斗草）
华盛,丹莫娜丽莎 Dan Tobacco Mona Lisa 100g,丹,莫娜丽莎 Dan Tobacco Mona Lisa,162.8,244.2,23.98,120,19.20,1221.0,19.2,36.43,40.53,100,无货,烟斗（斗草）
华盛,丹托斯卡纳的回忆 Dan Tobacco Memories of Tuscany 100g,丹,托斯卡纳的回忆 Dan Tobacco Memories of Tuscany,162.8,244.2,23.98,120,19.20,1221.0,19.2,36.43,40.53,100,无货,烟斗（斗草）
华盛,丹野生浆果 Dan Tobacco Wild Berries 100g,丹,野生浆果 Dan Tobacco Wild Berries,162.8,244.2,23.98,120,19.20,1221.0,19.2,36.43,40.53,100,无货,烟斗（斗草）
华盛,马坝原味精选 Mac Baren Original Choice 40g,馬霸,马坝原味精选 Original Choice,65.12,97.68,9.59,48,7.68,1221.0,7.68,36.43,40.53,40,无货,烟斗（斗草）
华盛,马坝芬芳精选 Mac Baren Aromatic Choice 40g,馬霸,马坝芬芳精选 Aromatic Choice,65.12,97.68,9.59,48,7.68,1221.0,7.68,36.43,40.53,40,无货,烟斗（斗草）
华盛,马坝香草精选 Mac Baren Vanilla Choice 40g,馬霸,马坝香草精选 Vanilla Choice,65.12,97.68,9.59,48,7.68,1221.0,7.68,36.43,40.53,40,无货,烟斗（斗草）
华盛,马坝银立方体 Mac Baren Cube Silver 40g,馬霸,马坝银立方体 Cube Silver,65.12,97.68,9.59,48,7.68,1221.0,7.68,36.43,40.53,40,库存仅剩 1,烟斗（斗草）
华盛,马坝金立方体 Mac Baren Cube Gold 40g,馬霸,马坝金立方体 Cube Gold,65.12,97.68,9.59,48,7.68,1221.0,7.68,36.43,40.53,40,库存仅剩 1,烟斗（斗草）
华盛,拉特雷兴旺绽放 Rattray&#8217;s Blossom Temptation 100g,拉特雷,兴旺绽放 &#8217;s Blossom Temptation,163.71,245.56,24.11,120,19.20,1227.8,19.2,36.62,40.72,100,库存仅剩 3,烟斗（斗草）
华盛,拉特雷加勒比梦 Rattray&#8217;s Carribbean Dream 100g,拉特雷,加勒比梦 &#8217;s Carribbean Dream,163.71,245.56,24.11,120,19.20,1227.8,19.2,36.62,40.72,100,库存仅剩 4,烟斗（斗草）
华盛,拉特雷异国热情 Rattray&#8217;s Exotic Passion 100g,拉特雷,异国热情 &#8217;s Exotic Passion,163.71,245.56,24.11,120,19.20,1227.8,19.2,36.62,40.72,100,库存仅剩 2,烟斗（斗草）
华盛,丹周日最佳 Dan Tobacco Sunday&#8217;s Best 100g,丹,周日最佳 Dan Tobacco Sunday&#8217;s Best,163.77,245.66,24.12,120,19.20,1228.3,19.2,36.63,40.73,100,库存仅剩 1,烟斗（斗草）
花店,Acrema Blend 20g装,Acrema,Blend,32.76,49.14,4.82,24,3.84,1228.5,3.84,36.64,40.74,20,?,手卷（手卷丝）
华盛,飞机大西洋巡航混合物圆罐 Stanislaw Atlantic Cruise Mixture Round Tin 50g,飞机大西洋巡航混合物圆罐,Stanislaw Atlantic Cruise Mixture Round,82.03,123.05,12.08,60,9.60,1230.5,9.6,36.69,40.79,50,库存仅剩 2,烟斗（斗草）
华盛,飞机纯拉塔基亚圆罐 Stanislaw Latakia Round Tin 50g,飞机纯拉塔基亚圆罐,Stanislaw Latakia Round Tin,82.03,123.05,12.08,60,9.60,1230.5,9.6,36.69,40.79,50,无货,烟斗（斗草）
华盛,飞机黑色卡文迪许圆罐 Stanislaw Black Cavendish Round Tin 50g,飞机黑色卡文迪许圆罐,Stanislaw Black Cavendish Round Tin,82.03,123.05,12.08,60,9.60,1230.5,9.6,36.69,40.79,50,库存仅剩 3,烟斗（斗草）
花店,Perfect Blend Fine Cut 40g装,Perfect,Blend Fine Cut,65.99,98.98,9.72,48,7.68,1237.25,7.68,36.88,40.98,40,?,手卷（手卷丝）
华盛,飞机黑莓铁罐 Stanislaw Blackberry Blend Tin 50g,飞机黑莓铁罐,Stanislaw Blackberry Blend Tin,82.52,123.78,12.15,60,9.60,1237.8,9.6,36.9,41.0,50,有货,烟斗（斗草）
华盛,飞机拉塔基亚铁罐 Stanislaw Balkan Latakia Tin 50g,飞机拉塔基亚铁罐,Stanislaw Balkan Latakia Tin,82.52,123.78,12.15,60,9.60,1237.8,9.6,36.9,41.0,50,有货,烟斗（斗草）
华盛,飞机苏格兰秋季切片 Stanislaw 4 Seasons Scottish Autumn Flake Tin 50g,飞机苏格兰秋季切片,Stanislaw 4 Seasons Scottish Autumn Flak,82.52,123.78,12.15,60,9.60,1237.8,9.6,36.9,41.0,50,库存仅剩 4,烟斗（斗草）
华盛,飞机英式夏季切片 Stanislaw 4 Season English Summer Flake Tin 50g,飞机英式夏季切片,Stanislaw 4 Season English Summer Flake,82.52,123.78,12.15,60,9.60,1237.8,9.6,36.9,41.0,50,库存仅剩 5,烟斗（斗草）
华盛,飞机爱尔兰春季片 Stanislaw 4 Season Irish Spring Flake Tin 50g,飞机爱尔兰春季片,Stanislaw 4 Season Irish Spring Flake Ti,82.52,123.78,12.15,60,9.60,1237.8,9.6,36.9,41.0,50,库存仅剩 3,烟斗（斗草）
华盛,飞机伦敦混合铁罐 Stanislaw London Mixture Tin 50g,飞机伦敦混合铁罐,Stanislaw London Mixture Tin,82.52,123.78,12.15,60,9.60,1237.8,9.6,36.9,41.0,50,有货,烟斗（斗草）
华盛,飞机元素空气混合 Stanislaw 4 Elements Air Mixture Tin 50g,飞机元素空气混合,Stanislaw 4 Elements Air Mixture Tin,82.52,123.78,12.15,60,9.60,1237.8,9.6,36.9,41.0,50,库存仅剩 2,烟斗（斗草）
华盛,飞机元素水混合 Stanislaw 4 Elements Water Mixture Tin 50g,飞机元素水混合,Stanislaw 4 Elements Water Mixture Tin,82.52,123.78,12.15,60,9.60,1237.8,9.6,36.9,41.0,50,库存仅剩 2,烟斗（斗草）
华盛,飞机香草铁罐 Stanislaw Vanilla Tin 50g,飞机香草铁罐,Stanislaw Vanilla Tin,82.52,123.78,12.15,60,9.60,1237.8,9.6,36.9,41.0,50,有货,烟斗（斗草）
华盛,飞机元素火混合 Stanislaw 4 Elements Fire Mixture Tin 50g,飞机元素火混合,Stanislaw 4 Elements Fire Mixture Tin,82.52,123.78,12.15,60,9.60,1237.8,9.6,36.9,41.0,50,库存仅剩 2,烟斗（斗草）
华盛,飞机元素土混合 Stanislaw 4 Elements Earth Mixture Tin 50g,飞机元素土混合,Stanislaw 4 Elements Earth Mixture Tin,82.52,123.78,12.15,60,9.60,1237.8,9.6,36.9,41.0,50,库存仅剩 2,烟斗（斗草）
华盛,飞机樱桃铁罐 Stanislaw Cherry Blend Tin 50g,飞机樱桃铁罐,Stanislaw Cherry Blend Tin,82.52,123.78,12.15,60,9.60,1237.8,9.6,36.9,41.0,50,有货,烟斗（斗草）
华盛,飞机冬季时刻切片 Stanislaw 4 Seasons Winter Time Flake Tin 50g,飞机冬季时刻切片,Stanislaw 4 Seasons Winter Time Flake Ti,82.52,123.78,12.15,60,9.60,1237.8,9.6,36.9,41.0,50,库存仅剩 5,烟斗（斗草）
花店,R&W Classic Shag 100g Paper Can,R&W,Classic Shag 100g Paper Can,166.14,249.21,24.47,120,19.20,1246.05,19.2,37.13,41.23,100,?,手卷（手卷丝）
花店,R&W Green 100g Paper Can,R&W,Green 100g Paper Can,166.14,249.21,24.47,120,19.20,1246.05,19.2,37.13,41.23,100,?,手卷（手卷丝）
花店,R&W Premium 100g Paper Can,R&W,Premium 100g Paper Can,166.14,249.21,24.47,120,19.20,1246.05,19.2,37.13,41.23,100,?,手卷（手卷丝）
华盛,KK蛇年限定 Kohlhase &#038; Kopp Year of the Snake 100g,KK蛇年限定,Kohlhase &#038; Kopp Year of the Snake,167.79,251.69,24.71,120,19.20,1258.45,19.2,37.48,41.58,100,无货,烟斗（斗草）
华盛,KK管道66限量版 Kohlhase &#038; Kopp Pipe 66 100g,KK管道66限量版,Kohlhase &#038; Kopp Pipe 66,167.79,251.69,24.71,120,19.20,1258.45,19.2,37.48,41.58,100,库存仅剩 1,烟斗（斗草）
花店,Hi-Tabaco Virginia Gold 30g装,Hi-Tabaco,Virginia Gold,50.54,75.81,7.44,36,5.76,1263.5,5.76,37.62,41.72,30,?,手卷（手卷丝）
花店,Hi-Tabaco Non-Additive Premium 30g装,Hi-Tabaco,Non-Additive Premium,50.54,75.81,7.44,36,5.76,1263.5,5.76,37.62,41.72,30,?,手卷（手卷丝）
华盛,巴西精神美混 Brazil Spirit American Blend 50g,巴西精神,美混 Brazil Spirit American Blend,84.53,126.8,12.45,60,9.60,1268.0,9.6,37.74,41.84,50,无货,手卷（手卷丝）
华盛,巴西精神经典 Brazil Spirit Classic 50g,巴西精神,经典 Brazil Spirit Classic,84.53,126.8,12.45,60,9.60,1268.0,9.6,37.74,41.84,50,有货,手卷（手卷丝）
华盛,萨维内利英式混合 Savinelli English Mixture 50g,萨维内利英式混合,Savinelli English Mixture,84.84,127.26,12.49,60,9.60,1272.6,9.6,37.87,41.97,50,无货,烟斗（斗草）
花店,R&W Gold 30g装,R&W,Gold,51.01,76.52,7.51,36,5.76,1275.33,5.76,37.95,42.05,30,?,手卷（手卷丝）
花店,R&W Premium 30g装,R&W,Premium,51.01,76.52,7.51,36,5.76,1275.33,5.76,37.95,42.05,30,?,手卷（手卷丝）
花店,R&W Classic 30g装,R&W,Classic,51.01,76.52,7.51,36,5.76,1275.33,5.76,37.95,42.05,30,?,手卷（手卷丝）
花店,R&W Green 30g装,R&W,Green,51.01,76.52,7.51,36,5.76,1275.33,5.76,37.95,42.05,30,?,手卷（手卷丝）
华盛,罗伯特麦康奈尔苏格兰混合 Robert McConnell Scottish Blend 50g,罗伯特麦康奈尔苏格兰混合,Robert McConnell Scottish Blend,85.07,127.6,12.53,60,9.60,1276.0,9.6,37.97,42.07,50,无货,烟斗（斗草）
华盛,拉森古典 W.O Larsen Old Fashioned 100g,拉森古典,W.O Larsen Old Fashioned,170.32,255.48,25.08,120,19.20,1277.4,19.2,38.01,42.11,100,无货,烟斗（斗草）
华盛,拉森招牌 W.O Larsen Signature 100g,拉森招牌,W.O Larsen Signature,170.32,255.48,25.08,120,19.20,1277.4,19.2,38.01,42.11,100,无货,烟斗（斗草）
华盛,拉森 1864 W.O Larsen 1864 100g,拉森,1864 W.O Larsen 1864,170.32,255.48,25.08,120,19.20,1277.4,19.2,38.01,42.11,100,无货,烟斗（斗草）
华盛,拉森经典 W. O. Larsen Classic 100g,拉森经典,W. O. Larsen Classic,170.32,255.48,25.08,120,19.20,1277.4,19.2,38.01,42.11,100,无货,烟斗（斗草）
花店,曼尼顿/Manitou Organic 25g装,曼尼顿,/Manitou Organic,42.59,63.89,6.27,30,4.80,1277.8,4.8,38.02,42.12,25,?,手卷（手卷丝）
花店,Bi Bo Fine Cut 40g装,Bi,Bo Fine Cut,70.2,105.3,10.34,48,7.68,1316.25,7.68,39.09,43.19,40,?,手卷（手卷丝）
花店,Blue Note Fine Cut 40g装,Blue,Note Fine Cut,70.2,105.3,10.34,48,7.68,1316.25,7.68,39.09,43.19,40,?,手卷（手卷丝）
华盛,彼得森老饕之选 Peterson Connoisseur&#8217;s Choice 50g,彼得森,老饕之选 Connoisseur&#8217;s Choice,88.2,132.3,12.99,60,9.60,1323.0,9.6,39.28,43.38,50,有货,烟斗（斗草）
华盛,彼得森奢华混合 Peterson Luxury Blend 50g,彼得森,奢华混合 Luxury Blend,88.2,132.3,12.99,60,9.60,1323.0,9.6,39.28,43.38,50,有货,烟斗（斗草）
华盛,彼得森落日微风 Peterson Sunset Breeze 50g,彼得森,落日微风 Sunset Breeze,88.2,132.3,12.99,60,9.60,1323.0,9.6,39.28,43.38,50,无货,烟斗（斗草）
华盛,彼得森豪华混合 Peterson De Luxe Mixture 50g,彼得森,豪华混合 De Luxe Mixture,88.2,132.3,12.99,60,9.60,1323.0,9.6,39.28,43.38,50,库存仅剩 1,烟斗（斗草）
华盛,彼得森甜基拉尼 Peterson Sweet Killarney 50g,彼得森,甜基拉尼 Sweet Killarney,88.2,132.3,12.99,60,9.60,1323.0,9.6,39.28,43.38,50,库存仅剩 1,烟斗（斗草）
华盛,彼得森古老都柏林 Peterson Old Dublin 50g,彼得森,古老都柏林 Old Dublin,88.2,132.3,12.99,60,9.60,1323.0,9.6,39.28,43.38,50,库存仅剩 1,烟斗（斗草）
华盛,彼得森爱尔兰切片 Peterson Irish Flake 50g,彼得森,爱尔兰切片 Irish Flake,88.2,132.3,12.99,60,9.60,1323.0,9.6,39.28,43.38,50,库存仅剩 2,烟斗（斗草）
华盛,彼得森福尔摩斯 Peterson Sherlock Holmes 50g,彼得森,福尔摩斯 Sherlock Holmes,88.2,132.3,12.99,60,9.60,1323.0,9.6,39.28,43.38,50,无货,烟斗（斗草）
华盛,拉特雷西敏寺 Rattray&#8217;s Westminster Abbey 50g,拉特雷,西敏寺 &#8217;s Westminster Abbey,88.23,132.34,12.99,60,9.60,1323.4,9.6,39.3,43.4,50,无货,烟斗（斗草）
华盛,拉特雷马林切片 Rattray&#8217;s Marlin Flake 100g,拉特雷,马林切片 &#8217;s Marlin Flake,176.55,264.83,26.0,120,19.20,1324.15,19.2,39.32,43.42,100,有货,烟斗（斗草）
华盛,拉特雷海拉小巷 Rattray&#8217;s Hal O The Wynd 100g,拉特雷,海拉小巷 &#8217;s Hal O The Wynd,176.55,264.83,26.0,120,19.20,1324.15,19.2,39.32,43.42,100,有货,烟斗（斗草）
华盛,拉特雷红毛匪 Rattray&#8217;s Red Raparee 100g,拉特雷,红毛匪 &#8217;s Red Raparee,176.55,264.83,26.0,120,19.20,1324.15,19.2,39.32,43.42,100,有货,烟斗（斗草）
华盛,拉特雷老高里 Rattray&#8217;s Old Gowrie 100g,拉特雷,老高里 &#8217;s Old Gowrie,176.55,264.83,26.0,120,19.20,1324.15,19.2,39.32,43.42,100,有货,烟斗（斗草）
华盛,温斯洛哈莱金 Winslow Harlekin 100g,温斯洛哈莱金,Winslow Harlekin,179.6,269.4,26.45,120,19.20,1347.0,19.2,39.96,44.06,100,无货,烟斗（斗草）
华盛,彼得森965 Peterson 965 50g,彼得森,965,92.0,138.0,13.55,60,9.60,1380.0,9.6,40.88,44.98,50,有货,烟斗（斗草）
华盛,彼得森公鸡 Peterson Early Morning 50g,彼得森,公鸡 Early Morning,92.0,138.0,13.55,60,9.60,1380.0,9.6,40.88,44.98,50,有货,烟斗（斗草）
华盛,彼得森睡帽 Peterson Nightcap 50g,彼得森,睡帽 Nightcap,92.0,138.0,13.55,60,9.60,1380.0,9.6,40.88,44.98,50,无货,烟斗（斗草）
华盛,拉森北欧经典2025限量版 2025 W. O. Larsen Nordic Classic Limited Edition 2025 100g,拉森北欧经典,2025限量版 2025 W. O. Larsen Nordic Classic,185.35,278.02,27.3,120,19.20,1390.1,19.2,41.16,45.26,100,无货,烟斗（斗草）
华盛,索拉你660银切片 Solani 660 Silver Flake 100g,索拉尼,660银切片 Solani 660 Silver Flake,186.39,279.58,27.45,120,19.20,1397.9,19.2,41.38,45.48,100,无货,烟斗（斗草）
华盛,罗伯特麦康奈尔拉塔基亚切片 Robert McConnell Latakia Flake 50g,罗伯特麦康奈尔拉塔基亚切片,Robert McConnell Latakia Flake,94.82,142.23,13.96,60,9.60,1422.3,9.6,42.06,46.16,50,无货,烟斗（斗草）
华盛,阿斯顿工匠 Ashton Artisan&#8217;s Blend 50g,阿斯顿工匠,Ashton Artisan&#8217;s Blend,96.19,144.28,14.17,60,9.60,1442.8,9.6,42.64,46.74,50,有货,烟斗（斗草）
华盛,罗伯特麦康奈尔黑鹦鹉 Robert McConell Black Parrot 100g,罗伯特麦康奈尔黑鹦鹉,Robert McConell Black Parrot,194.21,291.31,28.6,120,19.20,1456.55,19.2,43.02,47.12,100,无货,烟斗（斗草）
华盛,丹麦克 Dan Tobacco Mike&#8217;s Ready Rubbed 50g,丹,麦克 Dan Tobacco Mike&#8217;s Ready Rubbed,100.76,151.14,14.84,60,9.60,1511.4,9.6,44.56,48.66,50,无货,烟斗（斗草）
华盛,丹甜香草蜜露 Dan Tobacco Sweet Vanilla Honeydew 50g,丹,甜香草蜜露 Dan Tobacco Sweet Vanilla Honeydew,100.76,151.14,14.84,60,9.60,1511.4,9.6,44.56,48.66,50,无货,烟斗（斗草）
华盛,黄绞盘方 Capstan Yellow Square 50g,PS,黄绞盘方 tan Yellow Square,101.37,152.06,14.93,60,9.60,1520.6,9.6,44.82,48.92,50,有货,烟斗（斗草）
华盛,蓝绞盘方 Capstan Blue Square 50g,PS,蓝绞盘方 tan Blue Square,101.37,152.06,14.93,60,9.60,1520.6,9.6,44.82,48.92,50,无货,烟斗（斗草）
华盛,彼得森标准混合 Peterson Standard Mixture 50g,彼得森,标准混合 Standard Mixture,104.03,156.05,15.32,60,9.60,1560.5,9.6,45.93,50.03,50,有货,烟斗（斗草）
华盛,彼得森伊丽莎白混合 Peterson Elizabethan mixture 50g,彼得森,伊丽莎白混合 Elizabethan mixture,104.03,156.05,15.32,60,9.60,1560.5,9.6,45.93,50.03,50,有货,烟斗（斗草）
华盛,彼得森皇家游艇 Peterson Royal Yacht 50g,彼得森,皇家游艇 Royal Yacht,104.03,156.05,15.32,60,9.60,1560.5,9.6,45.93,50.03,50,无货,烟斗（斗草）
华盛,黑法官 Orlik Dark Strong Kentucky 50g,Kent,黑法官 ucky,105.85,158.77,15.59,60,9.60,1587.7,9.6,46.7,50.8,50,有货,烟斗（斗草）
华盛,红法官 Orlik Golden Sliced 50g,红法官,Orlik Golden Sliced,105.85,158.77,15.59,60,9.60,1587.7,9.6,46.7,50.8,50,无货,烟斗（斗草）
华盛,索拉尼633维吉尼亚切片 Solani 633 Virginia Flake 50g,索拉尼,633维吉尼亚切片 Solani 633 Virginia Flake,106.79,160.19,15.73,60,9.60,1601.9,9.6,47.09,51.19,50,无货,烟斗（斗草）
华盛,索拉尼656陈年白肋烟片 Solani 656 Aged Burley Flake 50g,索拉尼,656陈年白肋烟片 Solani 656 Aged Burley Flake,106.79,160.19,15.73,60,9.60,1601.9,9.6,47.09,51.19,50,有货,烟斗（斗草）
华盛,丹魔鬼的假期 Dan Tobacco Devil&#8217;s Holiday 50g,丹,魔鬼的假期 Dan Tobacco Devil&#8217;s Holiday,107.21,160.81,15.79,60,9.60,1608.1,9.6,47.27,51.37,50,有货,烟斗（斗草）
华盛,丹咸狗 Dan Salty Dogs 50g,丹,咸狗 Dan Salty Dogs,108.94,163.41,16.04,60,9.60,1634.1,9.6,47.99,52.09,50,有货,烟斗（斗草）
华盛,康奈尔和迪尔傲摩卡 Cornell &#038; Diehl Mocha 57g,康奈尔和迪尔傲摩卡,Cornell &#038; Diehl Mocha,124.2,186.3,18.29,68,10.88,1634.21,10.88,48.0,52.1,57,库存仅剩 3,烟斗（斗草）
华盛,康奈尔和迪尔密西西比泥 Cornell &#038; Diehl Mississippi Mud 57g,康奈尔和迪尔密西西比泥,Cornell &#038; Diehl Mississippi Mud,124.2,186.3,18.29,68,10.88,1634.21,10.88,48.0,52.1,57,库存仅剩 1,烟斗（斗草）
华盛,康奈尔和迪尔卡俊卡克 Cornell &#038; Diehl Kajun Kake 57g,康奈尔和迪尔卡俊卡克,Cornell &#038; Diehl Kajun Kake,124.2,186.3,18.29,68,10.88,1634.21,10.88,48.0,52.1,57,库存仅剩 3,烟斗（斗草）
华盛,康奈尔和迪尔比利巴德 Cornell &#038; Diehl Billy Budd 57g,康奈尔和迪尔比利巴德,Cornell &#038; Diehl Billy Budd,124.2,186.3,18.29,68,10.88,1634.21,10.88,48.0,52.1,57,库存仅剩 4,烟斗（斗草）
华盛,康奈尔和迪尔河口早晨切片 Cornell &#038; Diehl Bayou Morning Flake 57g,康奈尔和迪尔河口早晨切片,Cornell &#038; Diehl Bayou Morning Flake,124.2,186.3,18.29,68,10.88,1634.21,10.88,48.0,52.1,57,无货,烟斗（斗草）
华盛,康奈尔和迪尔秋夜 Cornell &#038; Diehl Autumn Evening 57g,康奈尔和迪尔秋夜,Cornell &#038; Diehl Autumn Evening,124.2,186.3,18.29,68,10.88,1634.21,10.88,48.0,52.1,57,无货,烟斗（斗草）
华盛,康奈尔和迪尔周日野餐 Cornell &#038; Diehl Sunday Picnic 57g,康奈尔和迪尔周日野餐,Cornell &#038; Diehl Sunday Picnic,124.2,186.3,18.29,68,10.88,1634.21,10.88,48.0,52.1,57,库存仅剩 3,烟斗（斗草）
华盛,SG巧克力切片 Samuel Gawith Chocolate Flake 50g,SG,巧克力切片 Samuel Gawith Chocolate Flake,110.0,165.0,16.2,60,9.60,1650.0,9.6,48.44,52.54,50,有货,烟斗（斗草）
华盛,SG官门椰子调味草 Samuel Gawith Palace Gate 50g,SG,官门椰子调味草 Samuel Gawith Palace Gate,110.0,165.0,16.2,60,9.60,1650.0,9.6,48.44,52.54,50,有货,烟斗（斗草）
华盛,SG飞机 Samuel Gawith Squadron Leader 50g,SG,飞机 Samuel Gawith Squadron Leader,110.0,165.0,16.2,60,9.60,1650.0,9.6,48.44,52.54,50,有货,烟斗（斗草）
华盛,SG湖边 Samuel Gawith Lakeland Dark 50g,SG,湖边 Samuel Gawith Lakeland Dark,110.0,165.0,16.2,60,9.60,1650.0,9.6,48.44,52.54,50,库存仅剩 5,烟斗（斗草）
华盛,SG火舞切片 Samuel Gawith Fire Dance Flake 50g,SG,火舞切片 Samuel Gawith Fire Dance Flake,110.0,165.0,16.2,60,9.60,1650.0,9.6,48.44,52.54,50,有货,烟斗（斗草）
华盛,SG海军切片 Samuel Gawith Navy Flake 50g,SG,海军切片 Samuel Gawith Navy Flake,110.0,165.0,16.2,60,9.60,1650.0,9.6,48.44,52.54,50,有货,烟斗（斗草）
华盛,SG小屋切片 Samuel Gawith Bothy Flake 50g,SG,小屋切片 Samuel Gawith Bothy Flake,110.0,165.0,16.2,60,9.60,1650.0,9.6,48.44,52.54,50,有货,烟斗（斗草）
华盛,SG猎犬 Samuel Gawith Grousemoor 50g,SG,猎犬 Samuel Gawith Grousemoor,110.0,165.0,16.2,60,9.60,1650.0,9.6,48.44,52.54,50,有货,烟斗（斗草）
华盛,G.L. 西明寺 G.L. Pease Westminster 57g,G.L.,西明寺 G.L. Pease Westminster,127.16,190.74,18.73,68,10.88,1673.16,10.88,49.09,53.19,57,无货,烟斗（斗草）
华盛,G.L. 静夜 G.L. Pease Quiet Nights 57g,G.L.,静夜 G.L. Pease Quiet Nights,127.16,190.74,18.73,68,10.88,1673.16,10.88,49.09,53.19,57,无货,烟斗（斗草）
华盛,G.L. 弗吉尼亚奶油 G.L. Pease The Virginia Cream 57g,G.L.,弗吉尼亚奶油 G.L. Pease The Virginia Cream,127.16,190.74,18.73,68,10.88,1673.16,10.88,49.09,53.19,57,无货,烟斗（斗草）
华盛,G.L. 煤气 G.L. Pease GasLight 57g,G.L.,煤气 G.L. Pease GasLight,127.16,190.74,18.73,68,10.88,1673.16,10.88,49.09,53.19,57,无货,烟斗（斗草）
华盛,G.L. 折刀 G.L. Pease JackKnife Ready Rubbed 57g,G.L.,折刀 G.L. Pease JackKnife Ready Rubbed,127.16,190.74,18.73,68,10.88,1673.16,10.88,49.09,53.19,57,库存仅剩 1,烟斗（斗草）
华盛,G.L. 奥德赛 G.L. Pease Odyssey 57g,G.L.,奥德赛 G.L. Pease Odyssey,127.16,190.74,18.73,68,10.88,1673.16,10.88,49.09,53.19,57,无货,烟斗（斗草）
华盛,G.L. 坎伯兰 G.L. Pease Cumberland 57g,G.L.,坎伯兰 G.L. Pease Cumberland,127.16,190.74,18.73,68,10.88,1673.16,10.88,49.09,53.19,57,库存仅剩 3,烟斗（斗草）
华盛,G.L. 子午线 G.L. Pease Meridian 57g,G.L.,子午线 G.L. Pease Meridian,127.16,190.74,18.73,68,10.88,1673.16,10.88,49.09,53.19,57,库存仅剩 3,烟斗（斗草）
华盛,G.L. 壮汉 G.L. Pease Robusto 57g,G.L.,壮汉 G.L. Pease Robusto,127.16,190.74,18.73,68,10.88,1673.16,10.88,49.09,53.19,57,库存仅剩 1,烟斗（斗草）
华盛,G.L. 切尔西之晨 G.L. Pease Chelsea Morning 57g,G.L.,切尔西之晨 G.L. Pease Chelsea Morning,127.16,190.74,18.73,68,10.88,1673.16,10.88,49.09,53.19,57,库存仅剩 2,烟斗（斗草）
华盛,G.L. 摄政切片 G.L. Pease Regents Flake 57g,G.L.,摄政切片 G.L. Pease Regents Flake,127.16,190.74,18.73,68,10.88,1673.16,10.88,49.09,53.19,57,无货,烟斗（斗草）
华盛,SG巴尔干切片 Samuel Gawith Balkan Flake 50g,SG,巴尔干切片 Samuel Gawith Balkan Flake,115.71,173.56,17.04,60,9.60,1735.6,9.6,50.84,54.94,50,有货,烟斗（斗草）
华盛,SG奶油切片 Samuel Gawith Kendal Cream Flake 50g,SG,奶油切片 Samuel Gawith Kendal Cream Flake,115.71,173.56,17.04,60,9.60,1735.6,9.6,50.84,54.94,50,有货,烟斗（斗草）
华盛,SG山姆切片 Samuel Gawith Sam&#8217;s Flake 50g,SG,山姆切片 Samuel Gawith Sam&#8217;s Flake,115.71,173.56,17.04,60,9.60,1735.6,9.6,50.84,54.94,50,无货,烟斗（斗草）
华盛,SG 最佳布朗切片 Samuel Gawith Best Brown Flake 50g,SG,最佳布朗切片 Samuel Gawith Best Brown Flake,115.71,173.56,17.04,60,9.60,1735.6,9.6,50.84,54.94,50,无货,烟斗（斗草）
华盛,SG 1792 切片 Samuel Gawith 1792 Flake 50g,SG,1792 切片 Samuel Gawith 1792 Flake,115.71,173.56,17.04,60,9.60,1735.6,9.6,50.84,54.94,50,无货,烟斗（斗草）
华盛,SG黑森林 Samuel Gawith Black Forest 50g,SG,黑森林 Samuel Gawith Black Forest,115.71,173.56,17.04,60,9.60,1735.6,9.6,50.84,54.94,50,有货,烟斗（斗草）
华盛,SG蓝狗 Samuel Gawith Perfection 50g,SG,蓝狗 Samuel Gawith Perfection,116.0,174.0,17.08,60,9.60,1740.0,9.6,50.96,55.06,50,有货,烟斗（斗草）
花店,大江戸刻 OH·EDO KIZAMI 30g装,大江戸刻,OH·EDO KIZAMI,77.22,115.83,11.37,36,5.76,1930.5,5.76,56.29,60.39,30,?,手卷（手卷丝）
华盛,SG弗吉尼亚切片 Samuel Gawith Full Virginia Flake 50g,SG,弗吉尼亚切片 Samuel Gawith Full Virginia Flake,128.9,193.35,18.98,60,9.60,1933.5,9.6,56.38,60.48,50,无货,烟斗（斗草）
华盛,彼得森暗切片 Peterson Dark Flake 50g,彼得森,暗切片 Dark Flake,132.93,199.4,19.58,60,9.60,1994.0,9.6,58.07,62.17,50,有货,烟斗（斗草）
华盛,彼得森小白切片 Peterson Flake 50g,彼得森,小白切片 Flake,132.93,199.4,19.58,60,9.60,1994.0,9.6,58.07,62.17,50,有货,烟斗（斗草）
华盛,彼得森豪华海船切片 Peterson De Luxe Navy Rolls 50g,彼得森,豪华海船切片 De Luxe Navy Rolls,133.73,200.59,19.7,60,9.60,2005.9,9.6,58.41,62.51,50,有货,烟斗（斗草）
花店,小粹 10g装,小粹,小粹,28.08,42.12,4.14,12,1.92,2106.0,1.92,61.21,65.31,10,?,手卷（手卷丝）
华盛,SG圣詹切片 Samuel Gawith St. James Flake 50g,SG,圣詹切片 Samuel Gawith St. James Flake,150.0,225.0,22.09,60,9.60,2250.0,9.6,65.24,69.34,50,无货,烟斗（斗草）
华盛,SG马车夫混合 Samuel Gawith Cabbie&#8217;s Mixture 50g,SG,马车夫混合 Samuel Gawith Cabbie&#8217;s Mixtu,150.22,225.33,22.12,60,9.60,2253.3,9.6,65.33,69.43,50,无货,烟斗（斗草）
华盛,华云休息室混合 Vauen Lounge Blend 50g,华云休息室混合,Vauen Lounge Blend,153.49,230.24,22.61,60,9.60,2302.4,9.6,66.71,70.81,50,无货,烟斗（斗草）
